{
  "workflow_run_id": "fixture-bullish-valid",
  "symbol": "EUR_USD",
  "timeframe": "15m",
  "source": {
    "name": "manual_sample",
    "mode": "manual"
  },
  "requested_by": {
    "channel": "manual_test",
    "user_id": "fixture"
  },
  "candles": [
    {"timestamp": "2026-06-08T00:00:00Z", "open": 1.1000, "high": 1.1010, "low": 1.0990, "close": 1.1005, "volume": 100, "complete": true},
    {"timestamp": "2026-06-08T00:15:00Z", "open": 1.1005, "high": 1.1012, "low": 1.0985, "close": 1.0995, "volume": 100, "complete": true},
    {"timestamp": "2026-06-08T00:30:00Z", "open": 1.0995, "high": 1.1000, "low": 1.0970, "close": 1.0990, "volume": 100, "complete": true},
    {"timestamp": "2026-06-08T00:45:00Z", "open": 1.0990, "high": 1.1010, "low": 1.0982, "close": 1.1000, "volume": 100, "complete": true},
    {"timestamp": "2026-06-08T01:00:00Z", "open": 1.1000, "high": 1.1020, "low": 1.0988, "close": 1.1010, "volume": 100, "complete": true}
  ],
  "support_resistance_context": {
    "near_support": true,
    "near_resistance": false,
    "notes": "Fixture assumes nearby support."
  },
  "trend_context": {
    "direction": "up",
    "moving_average_confirmation": "aligned",
    "notes": "Fixture assumes MA alignment."
  },
  "indicator_context": {
    "rsi_confirmation": "aligned",
    "macd_confirmation": "aligned",
    "notes": "Fixture assumes RSI and MACD alignment."
  }
}
